{
  "id": "ue-q1-quiz-04",
  "programAreaId": "unreal-engine",
  "title": "Q1 Quiz 4 Draft: Lighting, Landscapes, Foliage, and Mini-Worlds",
  "quarter": "Q1",
  "lessonIds": [
    "ue-q1-l14",
    "ue-q1-l15",
    "ue-q1-l16"
  ],
  "status": "draft",
  "isPublished": false,
  "questions": [
    {
      "id": "ue-q1-quiz-04-q01",
      "type": "multiple-choice",
      "text": "Which light type emits light in all directions from one point?",
      "choices": [
        "Point light",
        "Spotlight",
        "Rectangle light",
        "Landscape light"
      ],
      "correctAnswer": "Point light",
      "explanation": "A point light acts like a bulb and emits light outward in all directions.",
      "difficulty": "easy",
      "lessonId": "ue-q1-l14",
      "tag": "light-types"
    },
    {
      "id": "ue-q1-quiz-04-q02",
      "type": "multiple-choice",
      "text": "Which light type is most like sunlight coming from far away?",
      "choices": [
        "Directional light",
        "Point light",
        "Trigger volume",
        "Foliage light"
      ],
      "correctAnswer": "Directional light",
      "explanation": "Directional lights are used for sun-like light from an extremely far distance.",
      "difficulty": "easy",
      "lessonId": "ue-q1-l14",
      "tag": "directional-light"
    },
    {
      "id": "ue-q1-quiz-04-q03",
      "type": "multiple-choice",
      "text": "What is the main purpose of the Smooth tool in Landscape mode?",
      "choices": [
        "To soften harsh terrain bumps or sharp artifacts.",
        "To delete all foliage from the map.",
        "To turn every light into a skylight.",
        "To export the project to Google Drive."
      ],
      "correctAnswer": "To soften harsh terrain bumps or sharp artifacts.",
      "explanation": "Smooth reduces harsh changes in the landscape heightmap.",
      "difficulty": "easy",
      "lessonId": "ue-q1-l15",
      "tag": "smooth-tool"
    },
    {
      "id": "ue-q1-quiz-04-q04",
      "type": "multiple-choice",
      "text": "Why should foliage density be adjusted instead of always left high?",
      "choices": [
        "Too much foliage can hide the path, hurt readability, or affect performance.",
        "Density only changes the color of the sky.",
        "High density automatically creates Blueprints.",
        "Low density deletes the landscape."
      ],
      "correctAnswer": "Too much foliage can hide the path, hurt readability, or affect performance.",
      "explanation": "The transcript shows density being reduced repeatedly so trees and foliage do not overwhelm the scene.",
      "difficulty": "medium",
      "lessonId": "ue-q1-l16",
      "tag": "foliage-density"
    },
    {
      "id": "ue-q1-quiz-04-q05",
      "type": "multiple-choice",
      "text": "What does a Blueprint preview help students understand in the mini-world lesson?",
      "choices": [
        "How a scene could become interactive or playable.",
        "How to replace Google Drive submissions.",
        "How to make every mesh static.",
        "How to remove all lighting from a level."
      ],
      "correctAnswer": "How a scene could become interactive or playable.",
      "explanation": "The Blueprint preview connects the environment to simple player interaction without requiring a full game system.",
      "difficulty": "easy",
      "lessonId": "ue-q1-l16",
      "tag": "blueprint-preview"
    },
    {
      "id": "ue-q1-quiz-04-q06",
      "type": "vocabulary",
      "text": "Identify the term: a light that shines in one direction inside a cone shape.",
      "correctAnswer": "Spotlight",
      "explanation": "Spotlights use cone angles to control the beam and falloff.",
      "difficulty": "easy",
      "lessonId": "ue-q1-l14",
      "tag": "vocabulary"
    },
    {
      "id": "ue-q1-quiz-04-q07",
      "type": "vocabulary",
      "text": "Identify the term: the outdoor ground surface that can be sculpted into hills, valleys, and platforms.",
      "correctAnswer": "Landscape",
      "explanation": "The Landscape system is used to create and edit terrain.",
      "difficulty": "easy",
      "lessonId": "ue-q1-l15",
      "tag": "vocabulary"
    },
    {
      "id": "ue-q1-quiz-04-q08",
      "type": "vocabulary",
      "text": "Identify the term: the route a player is encouraged to follow through a space.",
      "correctAnswer": "Player path",
      "explanation": "A player path helps make a mini-world readable and playable.",
      "difficulty": "easy",
      "lessonId": "ue-q1-l16",
      "tag": "vocabulary"
    },
    {
      "id": "ue-q1-quiz-04-q09",
      "type": "vocabulary",
      "text": "Identify the term: a visual scripting asset used to create behavior or interaction in Unreal.",
      "correctAnswer": "Blueprint",
      "explanation": "Blueprints use nodes and visual scripting to create behavior without writing traditional code.",
      "difficulty": "easy",
      "lessonId": "ue-q1-l16",
      "tag": "vocabulary"
    },
    {
      "id": "ue-q1-quiz-04-q10",
      "type": "scenario",
      "text": "A student lights a scene with three lights, but the viewer does not know where to look. What should they adjust?",
      "correctAnswer": "They should adjust lighting direction, intensity, color, shadow, or placement to create a clear focal point.",
      "explanation": "Lighting should guide attention, not just make the whole scene equally bright.",
      "difficulty": "medium",
      "lessonId": "ue-q1-l14",
      "tag": "troubleshooting"
    },
    {
      "id": "ue-q1-quiz-04-q11",
      "type": "scenario",
      "text": "A landscape has sharp spikes and rough artifacts after sculpting. What tool or workflow should the student use?",
      "correctAnswer": "They should use Smooth to soften harsh shapes and adjust brush size or strength for more controlled sculpting.",
      "explanation": "The transcript shows Smooth as the fix for harsh landscapes after aggressive sculpting.",
      "difficulty": "medium",
      "lessonId": "ue-q1-l15",
      "tag": "troubleshooting"
    },
    {
      "id": "ue-q1-quiz-04-q12",
      "type": "scenario",
      "text": "Trees painted with Foliage mode are leaning sideways on a slope. What setting should the student check?",
      "correctAnswer": "They should check Align to Normal and turn it off if trees should grow straight up.",
      "explanation": "The transcript specifically notes unchecking Align to Normal so trees do not tilt with the landscape slope.",
      "difficulty": "medium",
      "lessonId": "ue-q1-l16",
      "tag": "troubleshooting"
    },
    {
      "id": "ue-q1-quiz-04-q13",
      "type": "process-order",
      "text": "Put this landscape workflow in order: create landscape, sculpt broad forms, flatten a usable area, smooth harsh edges, capture evidence.",
      "correctAnswer": "1. Create the landscape. 2. Sculpt broad forms. 3. Flatten a usable area. 4. Smooth harsh edges. 5. Capture evidence screenshots.",
      "explanation": "Landscape work should move from broad terrain creation into refinement and evidence capture.",
      "difficulty": "medium",
      "lessonId": "ue-q1-l15",
      "tag": "workflow"
    },
    {
      "id": "ue-q1-quiz-04-q14",
      "type": "process-order",
      "text": "Put this mini-world workflow in order: create terrain, add main path/focal point, paint foliage, adjust density/scale, play or camera test, submit evidence.",
      "correctAnswer": "1. Create terrain. 2. Add the main path or focal point. 3. Paint foliage. 4. Adjust density and scale. 5. Play or camera test. 6. Submit evidence.",
      "explanation": "The mini-world process should keep readability and player experience ahead of random decoration.",
      "difficulty": "medium",
      "lessonId": "ue-q1-l16",
      "tag": "workflow"
    },
    {
      "id": "ue-q1-quiz-04-q15",
      "type": "short-response",
      "text": "In 2-3 sentences, explain how lighting, terrain, and foliage work together to make a mini-world feel intentional.",
      "correctAnswer": "A strong answer explains that lighting creates mood and focus, terrain creates readable forms or paths, and foliage/props add believable detail without hiding the design. It should mention evidence such as screenshots, path readability, or focal point.",
      "explanation": "This checks synthesis across scene lighting, landscape shaping, and mini-world finishing.",
      "difficulty": "hard",
      "lessonId": "ue-q1-l16",
      "tag": "short-response"
    }
  ]
}
