{
  "id": "vp-q2-quiz-02",
  "programAreaId": "video-production",
  "title": "Q2 Quiz 2 Draft: Audio, Titles, Color, and Final Export",
  "quarter": "Q2",
  "lessonIds": [
    "vp-q2-l06",
    "vp-q2-l07",
    "vp-q2-l08",
    "vp-q2-l09"
  ],
  "status": "draft-pilot",
  "isPublished": false,
  "questions": [
    {
      "id": "vp-q2-quiz-02-q01",
      "type": "multiple-choice",
      "text": "Which Resolve page is designed for audio editing and mixing?",
      "choices": [
        "Fairlight",
        "Media",
        "Deliver",
        "Project Manager"
      ],
      "correctAnswer": "Fairlight",
      "explanation": "Fairlight is the audio-focused page in Resolve.",
      "difficulty": "easy",
      "lessonId": "vp-q2-l06",
      "tag": "fairlight"
    },
    {
      "id": "vp-q2-quiz-02-q02",
      "type": "multiple-choice",
      "text": "What does solo do on an audio track?",
      "choices": [
        "Plays that track while temporarily muting others.",
        "Deletes all other tracks.",
        "Exports the project.",
        "Changes the clip color to blue."
      ],
      "correctAnswer": "Plays that track while temporarily muting others.",
      "explanation": "Solo is useful for hearing one track clearly while mixing.",
      "difficulty": "easy",
      "lessonId": "vp-q2-l06",
      "tag": "solo"
    },
    {
      "id": "vp-q2-quiz-02-q03",
      "type": "multiple-choice",
      "text": "What does mute do on an audio track?",
      "choices": [
        "Turns that track off during playback.",
        "Makes the track louder.",
        "Adds a title.",
        "Creates a color node."
      ],
      "correctAnswer": "Turns that track off during playback.",
      "explanation": "Mute disables playback from that track until it is turned back on.",
      "difficulty": "easy",
      "lessonId": "vp-q2-l06",
      "tag": "mute"
    },
    {
      "id": "vp-q2-quiz-02-q04",
      "type": "multiple-choice",
      "text": "Why should audio tracks be named or colored?",
      "choices": [
        "To keep dialogue, music, ambience, and effects organized.",
        "To make the export render faster every time.",
        "To publish quiz answers.",
        "To remove the need for a timeline."
      ],
      "correctAnswer": "To keep dialogue, music, ambience, and effects organized.",
      "explanation": "Track organization helps editors find and balance layers quickly.",
      "difficulty": "easy",
      "lessonId": "vp-q2-l06",
      "tag": "track-organization"
    },
    {
      "id": "vp-q2-quiz-02-q05",
      "type": "multiple-choice",
      "text": "What is a title used for in an edit?",
      "choices": [
        "Readable text such as a title card, name label, or lower third.",
        "A raw camera file.",
        "A no-school calendar note.",
        "An audio waveform."
      ],
      "correctAnswer": "Readable text such as a title card, name label, or lower third.",
      "explanation": "Titles communicate text information inside the video.",
      "difficulty": "easy",
      "lessonId": "vp-q2-l07",
      "tag": "titles"
    },
    {
      "id": "vp-q2-quiz-02-q06",
      "type": "multiple-choice",
      "text": "Which panel is commonly used to adjust title text, position, and selected effect settings?",
      "choices": [
        "Inspector",
        "Project Manager",
        "Render Queue",
        "Media Storage"
      ],
      "correctAnswer": "Inspector",
      "explanation": "The Inspector exposes controls for selected clips, titles, transitions, and effects.",
      "difficulty": "easy",
      "lessonId": "vp-q2-l07",
      "tag": "inspector"
    },
    {
      "id": "vp-q2-quiz-02-q07",
      "type": "multiple-choice",
      "text": "What is a keyframe?",
      "choices": [
        "A point in time that stores a value so a property can change over time.",
        "The final exported file.",
        "A folder inside the Media Pool.",
        "The first day of the grading period."
      ],
      "correctAnswer": "A point in time that stores a value so a property can change over time.",
      "explanation": "Keyframes make motion or property changes happen over time.",
      "difficulty": "easy",
      "lessonId": "vp-q2-l07",
      "tag": "keyframes"
    },
    {
      "id": "vp-q2-quiz-02-q08",
      "type": "multiple-choice",
      "text": "What is the Color page used for?",
      "choices": [
        "Color correction and grading.",
        "Only class join codes.",
        "Only importing media.",
        "Only audio routing."
      ],
      "correctAnswer": "Color correction and grading.",
      "explanation": "The Color page is where Resolve handles shot color, contrast, exposure, and grading work.",
      "difficulty": "easy",
      "lessonId": "vp-q2-l08",
      "tag": "color-page"
    },
    {
      "id": "vp-q2-quiz-02-q09",
      "type": "multiple-choice",
      "text": "What does saturation control?",
      "choices": [
        "The strength or intensity of colors.",
        "The length of the render queue.",
        "The number of bins.",
        "The loudness of dialogue only."
      ],
      "correctAnswer": "The strength or intensity of colors.",
      "explanation": "Saturation controls how strong or muted colors appear.",
      "difficulty": "medium",
      "lessonId": "vp-q2-l08",
      "tag": "saturation"
    },
    {
      "id": "vp-q2-quiz-02-q10",
      "type": "multiple-choice",
      "text": "Which controls mainly affect dark, middle, and bright parts of an image?",
      "choices": [
        "Lift, gamma, and gain.",
        "Mute, solo, and bus.",
        "In, out, and append.",
        "Media, cut, and deliver."
      ],
      "correctAnswer": "Lift, gamma, and gain.",
      "explanation": "Lift affects darker tones, gamma affects midtones, and gain affects brighter tones.",
      "difficulty": "medium",
      "lessonId": "vp-q2-l08",
      "tag": "lift-gamma-gain"
    },
    {
      "id": "vp-q2-quiz-02-q11",
      "type": "multiple-choice",
      "text": "Which page is used to render or export the finished timeline?",
      "choices": [
        "Deliver",
        "Media",
        "Fairlight",
        "Fusion"
      ],
      "correctAnswer": "Deliver",
      "explanation": "The Deliver page is used to render the timeline into a finished video file.",
      "difficulty": "medium",
      "lessonId": "vp-q2-l09",
      "tag": "deliver"
    },
    {
      "id": "vp-q2-quiz-02-q12",
      "type": "multiple-choice",
      "text": "What is the render queue?",
      "choices": [
        "A list of export jobs waiting to render.",
        "A list of raw clips not imported.",
        "A folder of quiz answers.",
        "A set of A/B class periods."
      ],
      "correctAnswer": "A list of export jobs waiting to render.",
      "explanation": "Resolve adds export jobs to the render queue before rendering.",
      "difficulty": "medium",
      "lessonId": "vp-q2-l09",
      "tag": "render-queue"
    },
    {
      "id": "vp-q2-quiz-02-q13",
      "type": "vocabulary",
      "text": "Identify the term: the method used to compress and store video or audio data, such as H.264 or H.265.",
      "correctAnswer": "Codec",
      "explanation": "A codec controls how video/audio is encoded and compressed.",
      "difficulty": "medium",
      "lessonId": "vp-q2-l09",
      "tag": "vocabulary"
    },
    {
      "id": "vp-q2-quiz-02-q14",
      "type": "vocabulary",
      "text": "Identify the term: background room tone or environmental sound that helps a scene feel present.",
      "correctAnswer": "Ambience",
      "explanation": "Ambience fills the scene with realistic background sound.",
      "difficulty": "short-response",
      "lessonId": "vp-q2-l06",
      "tag": "vocabulary"
    },
    {
      "id": "vp-q2-quiz-02-q15",
      "type": "short-response",
      "text": "Name one final quality check an editor should make before exporting.",
      "correctAnswer": "A final check could include audio clarity, title readability, color consistency, timeline gaps, file name, or export settings.",
      "explanation": "A strong answer names a real pre-export check that affects viewer experience or file management.",
      "difficulty": "short-response",
      "lessonId": "vp-q2-l09",
      "tag": "workflow"
    }
  ]
}
