{
  "id": "vp-q2-quiz-01",
  "programAreaId": "video-production",
  "title": "Q2 Quiz 1 Draft: Resolve Setup, Media, Timelines, and Rough Cuts",
  "quarter": "Q2",
  "lessonIds": [
    "vp-q2-l01",
    "vp-q2-l02",
    "vp-q2-l03",
    "vp-q2-l04"
  ],
  "status": "draft-pilot",
  "isPublished": false,
  "questions": [
    {
      "id": "vp-q2-quiz-01-q01",
      "type": "multiple-choice",
      "text": "What is the Project Manager used for?",
      "choices": [
        "Creating, opening, backing up, and organizing Resolve projects.",
        "Color correcting a single clip only.",
        "Uploading videos directly to class rosters.",
        "Recording camera audio on set."
      ],
      "correctAnswer": "Creating, opening, backing up, and organizing Resolve projects.",
      "explanation": "The Project Manager is where Resolve projects are created, opened, exported, and organized.",
      "difficulty": "easy",
      "lessonId": "vp-q2-l01",
      "tag": "project-manager"
    },
    {
      "id": "vp-q2-quiz-01-q02",
      "type": "multiple-choice",
      "text": "Which Resolve page is mainly used to import and organize footage?",
      "choices": [
        "Media",
        "Fairlight",
        "Deliver",
        "Color"
      ],
      "correctAnswer": "Media",
      "explanation": "The Media page is designed for finding, importing, previewing, and organizing clips.",
      "difficulty": "easy",
      "lessonId": "vp-q2-l02",
      "tag": "media-page"
    },
    {
      "id": "vp-q2-quiz-01-q03",
      "type": "multiple-choice",
      "text": "What does the Media Pool contain?",
      "choices": [
        "Clips, bins, timelines, and other media that live in the project.",
        "Only the final exported movie.",
        "Only the raw files on the desktop.",
        "Only the teacher gradebook."
      ],
      "correctAnswer": "Clips, bins, timelines, and other media that live in the project.",
      "explanation": "The Media Pool is the project area that contains imported media and project assets.",
      "difficulty": "easy",
      "lessonId": "vp-q2-l02",
      "tag": "media-pool"
    },
    {
      "id": "vp-q2-quiz-01-q04",
      "type": "multiple-choice",
      "text": "Why are bins useful?",
      "choices": [
        "They organize clips into meaningful project folders.",
        "They automatically grade the final video.",
        "They delete unused media from the computer.",
        "They replace the timeline."
      ],
      "correctAnswer": "They organize clips into meaningful project folders.",
      "explanation": "Bins keep footage grouped so editors can find clips faster.",
      "difficulty": "easy",
      "lessonId": "vp-q2-l02",
      "tag": "bins"
    },
    {
      "id": "vp-q2-quiz-01-q05",
      "type": "multiple-choice",
      "text": "What is audio sync?",
      "choices": [
        "Matching separate audio and video so sound lines up correctly.",
        "Making all audio silent.",
        "Exporting the final file.",
        "Changing clip color in the bin."
      ],
      "correctAnswer": "Matching separate audio and video so sound lines up correctly.",
      "explanation": "Audio sync aligns separately recorded sound with video, often using waveforms.",
      "difficulty": "easy",
      "lessonId": "vp-q2-l03",
      "tag": "audio-sync"
    },
    {
      "id": "vp-q2-quiz-01-q06",
      "type": "multiple-choice",
      "text": "What does the source viewer show?",
      "choices": [
        "A clip before it is edited into the timeline.",
        "Only the final exported video.",
        "Only the class schedule.",
        "A list of quiz scores."
      ],
      "correctAnswer": "A clip before it is edited into the timeline.",
      "explanation": "The source viewer previews source media before it becomes part of the edit.",
      "difficulty": "easy",
      "lessonId": "vp-q2-l03",
      "tag": "source-viewer"
    },
    {
      "id": "vp-q2-quiz-01-q07",
      "type": "multiple-choice",
      "text": "What does the timeline viewer show?",
      "choices": [
        "The edited sequence at the current playhead position.",
        "Only files that are not imported.",
        "Only color palettes.",
        "Only audio meters."
      ],
      "correctAnswer": "The edited sequence at the current playhead position.",
      "explanation": "The timeline viewer shows what the active edit looks like at the playhead.",
      "difficulty": "easy",
      "lessonId": "vp-q2-l03",
      "tag": "timeline-viewer"
    },
    {
      "id": "vp-q2-quiz-01-q08",
      "type": "multiple-choice",
      "text": "What is an in point?",
      "choices": [
        "The selected start of the usable part of a source clip.",
        "The final export folder.",
        "The loudest part of an audio track.",
        "The name of a Resolve page."
      ],
      "correctAnswer": "The selected start of the usable part of a source clip.",
      "explanation": "An in point marks where the selected range begins.",
      "difficulty": "easy",
      "lessonId": "vp-q2-l04",
      "tag": "in-out"
    },
    {
      "id": "vp-q2-quiz-01-q09",
      "type": "multiple-choice",
      "text": "What is an out point?",
      "choices": [
        "The selected end of the usable part of a source clip.",
        "The project backup file.",
        "A color correction node.",
        "The main audio bus."
      ],
      "correctAnswer": "The selected end of the usable part of a source clip.",
      "explanation": "An out point marks where the selected range ends.",
      "difficulty": "medium",
      "lessonId": "vp-q2-l04",
      "tag": "in-out"
    },
    {
      "id": "vp-q2-quiz-01-q10",
      "type": "multiple-choice",
      "text": "What is a rough cut?",
      "choices": [
        "An early edit focused on order, timing, and story.",
        "A final color-graded export only.",
        "A folder of unorganized raw footage.",
        "A paid Studio-only effect."
      ],
      "correctAnswer": "An early edit focused on order, timing, and story.",
      "explanation": "A rough cut gets the story working before polish passes.",
      "difficulty": "medium",
      "lessonId": "vp-q2-l04",
      "tag": "rough-cut"
    },
    {
      "id": "vp-q2-quiz-01-q11",
      "type": "multiple-choice",
      "text": "Which choice best describes trimming?",
      "choices": [
        "Removing or restoring clip edges to control timing.",
        "Changing the school calendar.",
        "Creating a new Project Library.",
        "Uploading answers to students."
      ],
      "correctAnswer": "Removing or restoring clip edges to control timing.",
      "explanation": "Trimming adjusts where a clip starts or ends in the edit.",
      "difficulty": "medium",
      "lessonId": "vp-q2-l04",
      "tag": "trim"
    },
    {
      "id": "vp-q2-quiz-01-q12",
      "type": "multiple-choice",
      "text": "What does ripple trimming help prevent?",
      "choices": [
        "Unwanted gaps after shortening or extending edits.",
        "All color correction.",
        "Project Manager backups.",
        "Using the Media page."
      ],
      "correctAnswer": "Unwanted gaps after shortening or extending edits.",
      "explanation": "Ripple edits move timeline material so timing stays connected.",
      "difficulty": "medium",
      "lessonId": "vp-q2-l04",
      "tag": "ripple"
    },
    {
      "id": "vp-q2-quiz-01-q13",
      "type": "vocabulary",
      "text": "Identify the term: a horizontal lane in the timeline that holds video or audio clips.",
      "correctAnswer": "Track",
      "explanation": "Tracks organize timeline media into video or audio lanes.",
      "difficulty": "medium",
      "lessonId": "vp-q2-l03",
      "tag": "vocabulary"
    },
    {
      "id": "vp-q2-quiz-01-q14",
      "type": "vocabulary",
      "text": "Identify the term: information about a clip such as shot, scene, take, comments, or technical details.",
      "correctAnswer": "Metadata",
      "explanation": "Metadata helps editors identify and filter clips.",
      "difficulty": "short-response",
      "lessonId": "vp-q2-l02",
      "tag": "vocabulary"
    },
    {
      "id": "vp-q2-quiz-01-q15",
      "type": "short-response",
      "text": "In one sentence, explain why an editor should organize footage before making detailed edits.",
      "correctAnswer": "Organizing footage makes clips easier to find, reduces confusion, and speeds up editing decisions.",
      "explanation": "A strong answer connects organization to faster, clearer editing.",
      "difficulty": "short-response",
      "lessonId": "vp-q2-l02",
      "tag": "workflow"
    }
  ]
}
