{
  "id": "ue-q1-quiz-03",
  "programAreaId": "unreal-engine",
  "title": "Q1 Quiz 3 Draft: Master Materials, Static Meshes, Migration, and Lumen",
  "quarter": "Q1",
  "lessonIds": [
    "ue-q1-l10",
    "ue-q1-l11",
    "ue-q1-l12",
    "ue-q1-l13"
  ],
  "status": "draft",
  "isPublished": false,
  "questions": [
    {
      "id": "ue-q1-quiz-03-q01",
      "type": "multiple-choice",
      "text": "Why do master materials help a production workflow?",
      "choices": [
        "They let creators reuse one parent setup while changing exposed values in instances.",
        "They delete all material instances from the project.",
        "They make imported meshes ignore scale.",
        "They replace the need for lighting."
      ],
      "correctAnswer": "They let creators reuse one parent setup while changing exposed values in instances.",
      "explanation": "A master material provides the reusable structure, while instances expose controlled settings for variation.",
      "difficulty": "easy",
      "lessonId": "ue-q1-l10",
      "tag": "master-material"
    },
    {
      "id": "ue-q1-quiz-03-q02",
      "type": "multiple-choice",
      "text": "What should you check soon after importing a static mesh?",
      "choices": [
        "Scale, orientation, materials, and whether the asset appears correctly in the Content Drawer.",
        "Only the color of the viewport grid.",
        "Whether every light in the scene is static.",
        "Whether the mesh has a quiz attached."
      ],
      "correctAnswer": "Scale, orientation, materials, and whether the asset appears correctly in the Content Drawer.",
      "explanation": "Imported meshes should be verified for scale, placement, and missing material issues before evidence is submitted.",
      "difficulty": "easy",
      "lessonId": "ue-q1-l11",
      "tag": "static-mesh-import"
    },
    {
      "id": "ue-q1-quiz-03-q03",
      "type": "multiple-choice",
      "text": "Why is Unreal migration safer than copying a single visible asset file?",
      "choices": [
        "Migration includes dependencies such as materials and textures.",
        "Migration automatically creates a final screenshot.",
        "Migration makes every asset a Blueprint.",
        "Migration removes the need for a Content folder."
      ],
      "correctAnswer": "Migration includes dependencies such as materials and textures.",
      "explanation": "Migration uses the asset report to copy related dependencies that the visible asset needs.",
      "difficulty": "easy",
      "lessonId": "ue-q1-l12",
      "tag": "migration"
    },
    {
      "id": "ue-q1-quiz-03-q04",
      "type": "multiple-choice",
      "text": "What does global illumination describe in the Lumen lesson?",
      "choices": [
        "Light bouncing around a scene and filling areas indirectly.",
        "The keyboard shortcut for scaling objects.",
        "The list of folders in a project.",
        "A texture import setting for normal maps."
      ],
      "correctAnswer": "Light bouncing around a scene and filling areas indirectly.",
      "explanation": "The transcript describes global illumination as light bounce that can also carry surface color into nearby areas.",
      "difficulty": "easy",
      "lessonId": "ue-q1-l13",
      "tag": "global-illumination"
    },
    {
      "id": "ue-q1-quiz-03-q05",
      "type": "multiple-choice",
      "text": "Which evidence best proves a Lumen lighting improvement?",
      "choices": [
        "Before and after screenshots from the same camera angle showing changed bounce light, shadow fill, or realism.",
        "A screenshot of the login page.",
        "A reflection that says \"it looks better\" with no visual evidence.",
        "A screenshot with every light hidden."
      ],
      "correctAnswer": "Before and after screenshots from the same camera angle showing changed bounce light, shadow fill, or realism.",
      "explanation": "Lighting comparison evidence is strongest when the camera angle stays controlled and the visual change is clear.",
      "difficulty": "medium",
      "lessonId": "ue-q1-l13",
      "tag": "lighting-evidence"
    },
    {
      "id": "ue-q1-quiz-03-q06",
      "type": "vocabulary",
      "text": "Identify the term: the original reusable material that controls the structure and available settings for its instances.",
      "correctAnswer": "Master material or parent material",
      "explanation": "A master or parent material holds the reusable graph that instances inherit from.",
      "difficulty": "easy",
      "lessonId": "ue-q1-l10",
      "tag": "vocabulary"
    },
    {
      "id": "ue-q1-quiz-03-q07",
      "type": "vocabulary",
      "text": "Identify the term: a related asset that another asset needs in order to work correctly.",
      "correctAnswer": "Dependency",
      "explanation": "Dependencies can include materials, textures, meshes, or other linked project assets.",
      "difficulty": "easy",
      "lessonId": "ue-q1-l12",
      "tag": "vocabulary"
    },
    {
      "id": "ue-q1-quiz-03-q08",
      "type": "vocabulary",
      "text": "Identify the term: an Unreal asset representing imported 3D geometry that can be placed in a level.",
      "correctAnswer": "Static mesh",
      "explanation": "A static mesh is a 3D model asset used for props, environment pieces, and other non-skeletal objects.",
      "difficulty": "easy",
      "lessonId": "ue-q1-l11",
      "tag": "vocabulary"
    },
    {
      "id": "ue-q1-quiz-03-q09",
      "type": "vocabulary",
      "text": "Identify the term: lighting that updates while lights or objects move instead of relying only on baked light maps.",
      "correctAnswer": "Real-time lighting or dynamic lighting",
      "explanation": "The Lumen section focuses on dynamic global illumination that can respond as scene elements move.",
      "difficulty": "medium",
      "lessonId": "ue-q1-l13",
      "tag": "vocabulary"
    },
    {
      "id": "ue-q1-quiz-03-q10",
      "type": "scenario",
      "text": "A student creates a material instance but no useful controls appear in the instance. What should they check?",
      "correctAnswer": "They should check that values in the parent or master material were converted to named parameters and that Apply and Save were used.",
      "explanation": "Material instances can only edit exposed parameters from the parent setup.",
      "difficulty": "medium",
      "lessonId": "ue-q1-l10",
      "tag": "troubleshooting"
    },
    {
      "id": "ue-q1-quiz-03-q11",
      "type": "scenario",
      "text": "A migrated object appears in the destination project but its material is missing. What likely went wrong?",
      "correctAnswer": "The student may have copied only the visible mesh or selected the wrong destination instead of using Migrate with dependencies into the Content folder.",
      "explanation": "Missing materials often mean dependencies were not copied correctly or the destination workflow was wrong.",
      "difficulty": "medium",
      "lessonId": "ue-q1-l12",
      "tag": "troubleshooting"
    },
    {
      "id": "ue-q1-quiz-03-q12",
      "type": "scenario",
      "text": "A lighting screenshot looks brighter after an exposure change, but the shadows still look flat. What should the student explain or test next?",
      "correctAnswer": "They should explain that exposure changes brightness, then test bounce light, indirect light, movable light behavior, or Lumen/global illumination evidence.",
      "explanation": "Exposure and global illumination are related visually but are not the same concept.",
      "difficulty": "medium",
      "lessonId": "ue-q1-l13",
      "tag": "troubleshooting"
    },
    {
      "id": "ue-q1-quiz-03-q13",
      "type": "process-order",
      "text": "Put this migration workflow in order: choose asset/folder, choose Migrate, review asset report, select destination Content folder, verify in destination project.",
      "correctAnswer": "1. Choose the asset or folder. 2. Choose Migrate. 3. Review the asset report. 4. Select the destination project Content folder. 5. Verify the migrated assets in the destination project.",
      "explanation": "Students should use the migration workflow and verify the destination result before submitting evidence.",
      "difficulty": "medium",
      "lessonId": "ue-q1-l12",
      "tag": "workflow"
    },
    {
      "id": "ue-q1-quiz-03-q14",
      "type": "process-order",
      "text": "Put this lighting comparison workflow in order: frame a camera angle, capture before screenshot, adjust lighting/Lumen-related setting, capture after screenshot, write reflection.",
      "correctAnswer": "1. Frame a camera angle. 2. Capture the before screenshot. 3. Adjust the lighting or Lumen-related setting. 4. Capture the after screenshot from the same angle. 5. Write a reflection explaining the visual change.",
      "explanation": "A controlled comparison makes lighting evidence clearer and easier to grade.",
      "difficulty": "medium",
      "lessonId": "ue-q1-l13",
      "tag": "workflow"
    },
    {
      "id": "ue-q1-quiz-03-q15",
      "type": "short-response",
      "text": "In 2-3 sentences, explain why reusable material workflows and asset migration both help a studio work faster.",
      "correctAnswer": "A strong answer explains that reusable materials let artists create controlled variations without rebuilding graphs, while migration brings needed dependencies together so assets work in another project. Both reduce repeated work and prevent broken results.",
      "explanation": "This checks cross-lesson understanding of reuse, dependencies, and efficient production workflow.",
      "difficulty": "hard",
      "lessonId": "ue-q1-l12",
      "tag": "short-response"
    }
  ]
}
